{
  "schemaVersion": "1.0",
  "requestId": "hoa-nightclub-viral-2026-06",
  "project": "ring-platform-viral-hoa-nightclub",
  "purpose": "viral-ad",
  "refCode": "ring-viral-hoa-nightclub",
  "defaults": {
    "provider": "xai",
    "qualityMode": "draft",
    "aspectRatio": "16:9",
    "imageResolution": "2k",
    "videoResolution": "480p",
    "imageProvider": "xai",
    "duration": 10
  },
  "cast": [
    {
      "id": "guy",
      "label": "Handsome man late 30s",
      "description": "Ryan Gosling calm charm blended with Ryan Reynolds playful smirk, dark fitted jacket, subtle stubble, confident warm eyes"
    },
    {
      "id": "girl",
      "label": "Woman early 30s",
      "description": "Jennifer Lawrence energy — witty relaxed smile, casual chic black dress, silver ring on right hand"
    }
  ],
  "setting": "San Francisco nightclub interior at night, neon magenta and cobalt lights, crowded bar, loud club music energy, cinematic 35mm, bokeh, haze",
  "clips": [
    {
      "id": "01_hoa_video_call_pains",
      "duration": 10,
      "aspectRatio": "16:9",
      "scene": {
        "action": "Four suburban American neighbors on laptops and phones in split-screen video call grid, frustrated middle-aged HOA homeowners, one woman rubbing temples, one man pointing at messy spreadsheet, another scrolling email thread",
        "camera": "Multi-panel documentary realism, shallow depth of field, soft daylight through blinds"
      },
      "prompt": "Cinematic realistic multi-panel video call montage, four suburban American neighbors on laptops and phones in split-screen grid, frustrated middle-aged HOA homeowners in casual home clothes, muted beige and gray living rooms, one woman rubbing temples, one man pointing at messy spreadsheet on screen, another scrolling long email thread, overlay text feeling: parking rules fights, late fees confusion, nobody reads the newsletter. Soft daylight through blinds, authentic Midwest suburban tone, documentary realism, shallow depth of field, no logos, no readable UI text, 24fps film grain, empathetic frustrated mood, opening hook for community software story."
    },
    {
      "id": "02_ringize_audio_upload_prompt",
      "duration": 10,
      "aspectRatio": "16:9",
      "scene": {
        "action": "Over-the-shoulder shot of person at modern laptop, dark purple and gold settlement chat UI titled New Ring settlement, AI agent Reggie typing, user attaches HOA meeting audio file, cursor in large prompt box",
        "camera": "Warm desk lamp, shallow depth of field, UI glow on face, premium SaaS demo aesthetic"
      },
      "prompt": "Over-the-shoulder cinematic shot of a person at a modern laptop in a clean home office, screen shows a dark purple and gold futuristic settlement chat UI titled New Ring settlement, AI agent named Reggie typing a friendly reply, user attaches an audio file chip labeled HOA meeting recording m4a, cursor in a large prompt box where user writes about gathering their homeowners association network, subtle LegioX sparkle icon, ringdom.org vibe, soft keyboard typing hands, warm desk lamp, shallow depth of field, UI glow on face, hopeful productive mood, no legible tiny text except large readable headline New Ring settlement and Attach file icon, premium SaaS product demo aesthetic, 24fps."
    },
    {
      "id": "03_sf_nightclub_ring_opener",
      "duration": 12,
      "aspectRatio": "16:9",
      "firstFrame": {
        "imagePrompt": "{{girl}} and {{guy}} at a crowded San Francisco nightclub bar, she holds a cocktail, silver ring visible on her right hand, he leans in close over the music, neon magenta and cobalt rim light, photorealistic cinematic still"
      },
      "scene": {
        "action": "{{guy}} gestures warmly explaining a community platform while {{girl}} listens amused",
        "camera": "Medium two-shot at bar, cinematic 35mm, bokeh crowd blur",
        "dialogue": [
          {
            "speaker": "guy",
            "line": "So your HOA actually uses Ring?",
            "tone": "warmly over music"
          },
          {
            "speaker": "girl",
            "line": "Yeah — we finally stopped fighting over parking.",
            "tone": "laughing"
          }
        ]
      },
      "thumbnail": {
        "enabled": true,
        "template": "default",
        "overlays": [
          { "text": "Your HOA on Ring", "role": "title", "position": "bottom" },
          { "text": "Free · Open source · Your servers", "role": "subtitle", "position": "bottom-left" }
        ]
      }
    },
    {
      "id": "04_sf_nightclub_guy_notices_ring",
      "duration": 12,
      "aspectRatio": "16:9",
      "firstFrame": {
        "imagePrompt": "Medium close-up {{guy}} at SF nightclub bar, {{girl}} partially in frame smiling, his eyes glancing toward her silver ring catching neon light, same neon magenta and cobalt club atmosphere"
      },
      "scene": {
        "action": "{{guy}} glances down at her silver ring, smiles, looks up engaged",
        "camera": "Medium close-up, shallow depth of field, rim light on faces",
        "dialogue": [
          {
            "speaker": "guy",
            "line": "That ring looks incredible on you.",
            "tone": "flirtatious"
          }
        ]
      }
    },
    {
      "id": "05_sf_nightclub_ringize_payoff",
      "duration": 15,
      "aspectRatio": "16:9",
      "firstFrame": {
        "imagePrompt": "Two-shot {{guy}} and {{girl}} at SF nightclub bar, both with simple silver rings, cocktails, neon bokeh, wholesome flirt energy, cinematic photorealistic still"
      },
      "scene": {
        "action": "{{guy}} gestures enthusiastically then grins; {{girl}} laughs satisfied and raises glass to toast",
        "camera": "Two-shot payoff, cinematic 35mm, neon bokeh",
        "dialogue": [
          {
            "speaker": "guy",
            "line": "You can literally ringize your whole network — clone, customize, deploy.",
            "tone": "enthusiastic over music"
          },
          {
            "speaker": "girl",
            "line": "Ringize? I need that for my board.",
            "tone": "laughing satisfied"
          }
        ]
      },
      "thumbnail": {
        "enabled": true,
        "template": "cta_bar",
        "overlays": [
          { "text": "Ringize your community", "role": "cta", "position": "bottom" },
          { "text": "ring-platform.org", "role": "caption", "position": "bottom-right" }
        ]
      }
    }
  ]
}
